{
  "schema_version": "person-profile/v1",
  "asset_id": "person-sample",
  "name": "刘备",
  "role": "东汉末年军阀，蜀汉开国皇帝",
  "era": "东汉末年至三国时期",
  "summary": "刘备字玄德，自称汉景帝之后，早年以织席贩履为生，后来参与镇压黄巾起义，逐渐形成自己的政治和军事力量。东汉末年，刘备长期辗转于各地，曾先后依附或联合不同势力，在复杂的战争环境中寻求发展。赤壁之战前后，刘备与孙权联合抗击曹操，战后逐渐取得荆州部分地区，并进一步进入益州。公元221年，刘备在成都称帝，建立蜀汉政权，形成魏、蜀、吴三国鼎立的局面。刘备重视人才，诸葛亮、关羽、张飞等人长期追随于他。刘备晚年为夺回荆州、报复关羽之死而发动对吴战争，但最终失败。他的经历体现了东汉末年政治力量重组和蜀汉政权建立的过程。",
  "persona": "后续 AI 人物智能体使用的语气、知识边界与立场提示。",
  "boundaries": [
    "不要让人物知道其身后才发生的事件。"
  ],
  "keywords": [
    "赤壁之战、蜀汉、三国鼎立"
  ],
  "related_lessons": [
    "lesson-sample"
  ],
  "source_refs": [
    {
      "title": "《先主传》",
      "source": "《三国志》，中华书局点校本",
      "url_or_path": "卷三十二，刘备生平及蜀汉建立相关篇章",
      "citation_note": "",
      "reliability": "pending"
    },
    {
      "title": "《资治通鉴》相关篇章",
      "source": "《资治通鉴》，中华书局点校本",
      "url_or_path": "赤壁之战、刘备入蜀及蜀汉建立相关记载",
      "citation_note": "",
      "reliability": "pending"
    }
  ],
  "teacher_notes": "重点讲解刘备从地方势力发展为蜀汉建立者的过程。注意赤壁之战是孙刘联军共同抗曹，不能将胜利简单归于刘备个人；同时应区分刘备建立蜀汉与刘备自称“汉中王”的不同阶段。",
  "status": "sealed",
  "version": 52,
  "created_at": "2026-09-11T04:42:44.821865Z",
  "updated_at": "2026-09-14T13:49:59.002495Z",
  "sealed_at": "2026-09-14T13:49:59.002495Z",
  "sealed_by": "local-admin",
  "checksum": "2c502e7a5b701a1a63ff19217f102f9a9a44e545207efd1a5a2b3f2eec6a534a"
}
