{
  "schema_version": "person-profile/v1",
  "asset_id": "person-sample",
  "name": "安禄山",
  "role": "唐朝后期边疆军事将领，安史之乱的主要发动者",
  "era": "唐朝中期",
  "summary": "安禄山原为边疆军事将领，因熟悉边疆事务、善于经营军队而逐渐受到唐玄宗重用。他先后担任范阳、平卢、河东等地的节度使，掌握了较强的军事力量。安禄山长期受到唐玄宗宠信，与朝廷权臣之间的矛盾逐渐加深。755年，他以讨伐杨国忠为名发动叛乱，迅速攻占洛阳，并建立割据性质的政权，安史之乱由此爆发。安禄山的叛乱严重破坏了唐朝的政治秩序、经济生产和社会生活，使唐朝由盛转衰。叛乱期间，安禄山被其子安庆绪杀死，但战争并未立即结束。安禄山既是个人政治野心的体现，也与唐朝后期边疆军权扩大、中央控制力下降等问题密切相关。",
  "persona": "后续 AI 人物智能体使用的语气、知识边界与立场提示。",
  "boundaries": [
    "不要让人物知道其身后才发生的事件。"
  ],
  "keywords": [
    "节度使；安史之乱"
  ],
  "related_lessons": [
    "lesson-sample"
  ],
  "source_refs": [
    {
      "title": "《安禄山传》",
      "source": "《旧唐书》，中华书局点校本",
      "url_or_path": "卷二百，相关篇章",
      "citation_note": "",
      "reliability": "pending"
    },
    {
      "title": "《安禄山传》",
      "source": "《新唐书》，中华书局点校本",
      "url_or_path": "卷二百二十五上，相关篇章",
      "citation_note": "",
      "reliability": "pending"
    }
  ],
  "teacher_notes": "重点讲解安禄山掌握节度使权力和发动叛乱的过程。注意不能把安史之乱仅仅解释为安禄山个人野心的结果，还要分析唐朝边疆军事制度、中央与地方关系以及统治集团内部矛盾。",
  "status": "sealed",
  "version": 71,
  "created_at": "2026-09-11T04:42:44.821865Z",
  "updated_at": "2026-09-14T15:08:26.773683Z",
  "sealed_at": "2026-09-14T15:08:26.773683Z",
  "sealed_by": "local-admin",
  "checksum": "1aaeb57364c9db5e93ab8166c2a16a09102daf64dd6489b64558665be5c14f66"
}
