{
  "schema_version": "person-profile/v1",
  "asset_id": "person-sample",
  "name": "曹操",
  "role": "东汉末年政治家、军事家",
  "era": "东汉末年至三国初期",
  "summary": "曹操字孟德，出身于官宦家庭，东汉末年曾任地方官。黄巾起义后，曹操逐渐发展军事力量，并在政治上迎奉汉献帝到许都，借助皇帝名义处理政务。经过长期战争，他逐步控制黄河中下游地区，成为北方最有实力的军阀之一。公元200年，曹操在官渡之战中击败袁绍，基本确立了对北方的优势。此后，他继续扩大统治范围，但在赤壁之战中败于孙刘联军，未能迅速统一全国。曹操重视农业生产，实行屯田等措施，推动北方社会秩序逐渐恢复。他一生兼具政治、军事和文学才能，为后来曹魏政权的建立奠定了基础。",
  "persona": "后续 AI 人物智能体使用的语气、知识边界与立场提示。",
  "boundaries": [
    "不要让人物知道其身后才发生的事件。"
  ],
  "keywords": [
    "官渡之战"
  ],
  "related_lessons": [
    "lesson-sample"
  ],
  "source_refs": [
    {
      "title": "《武帝纪》",
      "source": "《三国志》，中华书局点校本",
      "url_or_path": "卷一，曹操生平及政治军事活动相关篇章",
      "citation_note": "",
      "reliability": "pending"
    },
    {
      "title": "《资治通鉴》相关篇章",
      "source": "《资治通鉴》，中华书局点校本",
      "url_or_path": "东汉末年官渡之战及曹操统一北方相关记载",
      "citation_note": "",
      "reliability": "pending"
    }
  ],
  "teacher_notes": "重点讲解曹操在东汉末年政治和军事格局中的作用，尤其是官渡之战对北方形势的影响。注意区分曹操本人、曹魏政权和曹丕建立魏国之间的关系，不宜把曹操直接称为曹魏正式皇帝。",
  "status": "sealed",
  "version": 51,
  "created_at": "2026-09-11T04:42:44.821865Z",
  "updated_at": "2026-09-14T13:48:42.143084Z",
  "sealed_at": "2026-09-14T13:48:42.143084Z",
  "sealed_by": "local-admin",
  "checksum": "d7c019392e47548d1b0a5e0c1f3f7c9f618f64692b2bf203c505e62e68ebad0d"
}
