{
  "schema_version": "person-profile/v1",
  "asset_id": "person-sample",
  "name": "郑玄",
  "role": "东汉末年著名经学家",
  "era": "东汉后期",
  "summary": "郑玄是东汉末年著名的经学家，长期研究儒家经典，曾向不同学者学习今文经学和古文经学。他重视对经典文字、章句、名物制度和思想含义的考释，广泛注释《周礼》《仪礼》《礼记》《毛诗》《尚书》《论语》等儒家典籍。郑玄的学术特点是兼采不同经学传统，努力综合各家解释，形成较为系统的经学注释体系。他的著作和注释在后世长期流传，成为研究先秦两汉经典、礼制和语言文字的重要资料。郑玄还培养了许多学生，对东汉末年及魏晋南北朝时期的学术传承产生了影响。他的学术活动推动了经学解释的系统化，也使儒家经典更容易被后世学者研读和传承。",
  "persona": "后续 AI 人物智能体使用的语气、知识边界与立场提示。",
  "boundaries": [
    "不要让人物知道其身后才发生的事件。"
  ],
  "keywords": [
    "经学、古文经学"
  ],
  "related_lessons": [
    "lesson-sample"
  ],
  "source_refs": [
    {
      "title": "《郑玄传》",
      "source": "《后汉书》，中华书局点校本",
      "url_or_path": "卷三十五，相关篇章",
      "citation_note": "",
      "reliability": "pending"
    },
    {
      "title": "《郑玄注》相关典籍",
      "source": "《十三经注疏》，中华书局整理本",
      "url_or_path": "《周礼》《仪礼》《礼记》《毛诗》等相关注释",
      "citation_note": "",
      "reliability": "pending"
    },
    {
      "title": "《儒林列传》",
      "source": "《后汉书》，中华书局点校本",
      "url_or_path": "东汉经学发展相关篇章",
      "citation_note": "",
      "reliability": "pending"
    }
  ],
  "teacher_notes": "重点讲解郑玄兼采今文经学与古文经学、注释儒家经典的学术特点。注意郑玄是经学家和经典注释者，不宜将其称为“五经博士”；“五经博士”主要是汉代国家设置的经学官职，并非郑玄的主要身份。",
  "status": "sealed",
  "version": 47,
  "created_at": "2026-09-11T04:42:44.821865Z",
  "updated_at": "2026-09-14T13:28:58.152699Z",
  "sealed_at": "2026-09-14T13:28:58.152699Z",
  "sealed_by": "local-admin",
  "checksum": "1802949ee4f19d48d1ec97b27cafda519a5e01eaeee9e8b28498fb692c39e287"
}
