{
  "schema_version": "person-profile/v1",
  "asset_id": "person-sample",
  "name": "吴王阖闾",
  "role": "春秋时期吴国国君",
  "era": "春秋晚期",
  "summary": "吴王阖闾是春秋晚期吴国的重要君主，也是吴国国力达到较强阶段的代表人物。阖闾即位后，重视任用人才和整顿军事，传统文献记载他曾任用伍子胥、孙武等人参与国家事务。吴国原本位于长江下游，阖闾时期逐渐加强对周边地区的控制，并积极参与春秋末期诸侯之间的军事竞争。公元前506年，吴军在柏举之战中击败楚军，随后攻入楚国都城郢，吴国的军事威望显著提高。阖闾还曾与越国发生冲突，吴越之间的竞争成为春秋晚期东南地区政治局势的重要组成部分。阖闾在对越作战中受伤，后来去世。吴王阖闾的统治使吴国成为春秋晚期的重要强国，并推动吴国从区域性国家逐渐进入诸侯争霸的中心舞台。后世将他列入“春秋五霸”的一种说法中。",
  "persona": "后续 AI 人物智能体使用的语气、知识边界与立场提示。",
  "boundaries": [
    "不要让人物知道其身后才发生的事件。"
  ],
  "keywords": [],
  "related_lessons": [
    "lesson-sample"
  ],
  "source_refs": [
    {
      "title": "《吴太伯世家》",
      "source": "《史记》，中华书局点校本",
      "url_or_path": "卷三十一；参考吴王阖闾的生平及吴国争霸活动",
      "citation_note": "",
      "reliability": "pending"
    },
    {
      "title": "《左传·定公四年》",
      "source": "《春秋左传》，中华书局相关版本",
      "url_or_path": "定公四年；参考吴国伐楚及柏举之战",
      "citation_note": "",
      "reliability": "pending"
    },
    {
      "title": "《吴越春秋》",
      "source": "中华书局相关整理本",
      "url_or_path": "相关篇章；参考吴越关系及阖闾活动的传统记载",
      "citation_note": "",
      "reliability": "pending"
    }
  ],
  "teacher_notes": "可围绕柏举之战分析吴国军事力量的提升，同时提醒学生区分《左传》等早期文献与后世吴越故事中的不同叙述。",
  "status": "sealed",
  "version": 15,
  "created_at": "2026-09-11T04:42:44.821865Z",
  "updated_at": "2026-09-14T09:25:53.264959Z",
  "sealed_at": "2026-09-14T09:25:53.264959Z",
  "sealed_by": "local-admin",
  "checksum": "367e89e306d33396ec306d261f08d71de7937f7cefc4ac81140dbb5a7c36d268"
}
