{
  "schema_version": "person-profile/v1",
  "asset_id": "person-sample",
  "name": "李隆基（唐玄宗）",
  "role": "唐朝皇帝，开元盛世的重要推动者",
  "era": "唐朝中期",
  "summary": "李隆基是唐睿宗之子，早年参与平定宫廷政治斗争，后来即位为唐玄宗。即位初期，他任用姚崇、宋璟等有能力的大臣，整顿吏治，重视农业生产和财政管理，调整国家行政和军事制度，使唐朝政治逐渐稳定，经济和文化得到发展。唐玄宗统治前期形成了历史上著名的“开元盛世”，唐朝国力达到较高水平。随着统治时间延长，唐玄宗逐渐疏于政事，重用李林甫等人，并扩大节度使的军事权力。755年，安禄山发动叛乱，安史之乱爆发，唐朝由盛转衰。唐玄宗在马嵬驿事件后退居太上皇。李隆基的统治体现了唐朝由繁荣走向危机的历史转折。",
  "persona": "后续 AI 人物智能体使用的语气、知识边界与立场提示。",
  "boundaries": [
    "不要让人物知道其身后才发生的事件。"
  ],
  "keywords": [
    "开元盛世；开元前期；节度使；安史之乱；马嵬驿"
  ],
  "related_lessons": [
    "lesson-sample"
  ],
  "source_refs": [
    {
      "title": "《玄宗本纪》",
      "source": "《旧唐书》，中华书局点校本",
      "url_or_path": "卷八、卷九，相关篇章",
      "citation_note": "",
      "reliability": "pending"
    },
    {
      "title": "《玄宗本纪》",
      "source": "《新唐书》，中华书局点校本",
      "url_or_path": "卷五，相关篇章",
      "citation_note": "",
      "reliability": "pending"
    }
  ],
  "teacher_notes": "重点讲解唐玄宗统治前期和后期的变化。注意“开元盛世”主要指开元前期的政治经济状况，不能将玄宗整个统治时期都视为盛世。同时，应分析节度使权力扩张与安史之乱之间的关系，但不能把安史之乱简单归结为单一人物或单一制度造成。",
  "status": "sealed",
  "version": 69,
  "created_at": "2026-09-11T04:42:44.821865Z",
  "updated_at": "2026-09-14T15:03:42.709983Z",
  "sealed_at": "2026-09-14T15:03:42.709983Z",
  "sealed_by": "local-admin",
  "checksum": "9e59ebfd62441853cd970d2c3fd3e9dcb3c6a65c288dc4081cf8f6cbe8546dcc"
}
