{
  "schema_version": "person-profile/v1",
  "asset_id": "person-sample",
  "name": "慧远",
  "role": "东晋著名佛教学者",
  "era": "东晋时期",
  "summary": "慧远是东晋时期著名的佛教学者，早年学习儒家和道家典籍，后来跟随道安学习佛教。东晋时期，他长期在庐山活动，组织僧团、讲授佛法，并与当时的士大夫和佛教学者保持交往。慧远重视佛教戒律和僧团建设，主张僧侣应保持相对独立的宗教身份。公元402年，他与众多僧人共同发起结社活动，后世通常将其视为净土信仰在中国发展的重要先声。慧远还通过著述和讲学，努力解释佛教与中国传统思想之间的关系，推动佛教在士人社会中的传播。他的活动促进了佛教在东晋社会的本土发展，对中国佛教思想和宗教组织建设产生了重要影响。",
  "persona": "后续 AI 人物智能体使用的语气、知识边界与立场提示。",
  "boundaries": [
    "不要让人物知道其身后才发生的事件。"
  ],
  "keywords": [
    "佛教东传、佛教中国化"
  ],
  "related_lessons": [
    "lesson-sample"
  ],
  "source_refs": [
    {
      "title": "《慧远传》",
      "source": "《高僧传》，中华书局相关整理本",
      "url_or_path": "慧远生平、庐山活动及佛教思想相关篇章",
      "citation_note": "",
      "reliability": "pending"
    },
    {
      "title": "《沙门不敬王者论》",
      "source": "慧远相关文集整理本",
      "url_or_path": "僧侣身份、佛教与世俗政治关系相关内容",
      "citation_note": "",
      "reliability": "pending"
    }
  ],
  "teacher_notes": "重点讲解慧远在庐山弘法、僧团建设以及佛教本土化方面的作用。注意慧远不是佛教传入中国的开创者，也不是净土宗成熟意义上的创始人；“净土信仰的先声”与后世宗派形成应加以区分。",
  "status": "sealed",
  "version": 60,
  "created_at": "2026-09-11T04:42:44.821865Z",
  "updated_at": "2026-09-14T14:06:18.878827Z",
  "sealed_at": "2026-09-14T14:06:18.878827Z",
  "sealed_by": "local-admin",
  "checksum": "33c2f9d52bfdeee0d5813d12740b8e653bf6081a730d02d211b6b31c65936342"
}
