{
  "schema_version": "person-profile/v1",
  "asset_id": "person-sample",
  "name": "熊侣（楚庄王）",
  "role": "春秋时期楚国国君",
  "era": "春秋时期",
  "summary": "熊侣，即楚庄王，是春秋时期楚国国君，也是楚国发展成为南方强国并参与中原争霸的重要人物。楚庄王即位初期，楚国面临国内政治需要调整、贵族关系复杂以及周边诸侯竞争等问题。传统文献记载，他曾在即位初期采取相对谨慎的政治姿态，后来逐渐加强对国家事务的掌握。楚庄王执政后，重视整顿政治、发展军事实力，并积极参与中原诸侯之间的竞争。公元前597年，楚军在邲之战中击败晋军，楚国在中原地区的影响力明显增强。楚庄王还曾通过问鼎等相关故事表现出对周王室权威和诸侯政治格局的挑战。后世常将他与“问鼎中原”“一鸣惊人”等典故联系起来。楚庄王的统治推动楚国成为春秋时期的重要强国，并改变了中原诸侯之间的力量平衡。",
  "persona": "后续 AI 人物智能体使用的语气、知识边界与立场提示。",
  "boundaries": [
    "不要让人物知道其身后才发生的事件。"
  ],
  "keywords": [
    "春秋五霸"
  ],
  "related_lessons": [
    "lesson-sample"
  ],
  "source_refs": [
    {
      "title": "《楚世家》",
      "source": "《史记》，中华书局点校本",
      "url_or_path": "卷四十；参考楚庄王的生平及楚国争霸活动",
      "citation_note": "",
      "reliability": "pending"
    },
    {
      "title": "《左传·宣公十二年》",
      "source": "《春秋左传》，中华书局相关版本",
      "url_or_path": "宣公十二年；参考邲之战及楚晋关系",
      "citation_note": "",
      "reliability": "pending"
    },
    {
      "title": "《左传·宣公三年》",
      "source": "《春秋左传》，中华书局相关版本",
      "url_or_path": "宣公三年；参考楚庄王问鼎相关记载",
      "citation_note": "",
      "reliability": "pending"
    }
  ],
  "teacher_notes": "可重点介绍楚庄王在邲之战后的政治影响，结合“问鼎”故事讨论春秋时期周王室权威变化与诸侯争霸。",
  "status": "sealed",
  "version": 17,
  "created_at": "2026-09-11T04:42:44.821865Z",
  "updated_at": "2026-09-14T09:39:59.256139Z",
  "sealed_at": "2026-09-14T09:39:59.256139Z",
  "sealed_by": "local-admin",
  "checksum": "f1db8629e35c1ace40f4cd77ba23d1fec8243ede27036b0359abcf40389bbbcd"
}
