{
  "schema_version": "person-profile/v1",
  "asset_id": "person-sample",
  "name": "李陵",
  "role": "西汉将领，李广之孙",
  "era": "西汉中期",
  "summary": "李陵是西汉时期的将领，出身于著名的军事家族，其祖父是将领李广。汉武帝时期，李陵率领少量步兵出征匈奴，曾在兵力处于明显劣势的情况下与匈奴军队作战，表现出较强的军事指挥能力。由于援军未能及时到达，李陵最终兵败被俘并留在匈奴。汉武帝得知消息后十分震怒，朝廷中多数大臣也对李陵加以指责。司马迁认为李陵在战斗中表现英勇，投降有复杂的战争背景，因此为他辩护，最终受到牵连而获罪。李陵的经历反映了西汉对外战争中军队补给、援军协同和将领责任之间的复杂问题，也成为司马迁人生和《史记》写作经历中的重要转折。",
  "persona": "后续 AI 人物智能体使用的语气、知识边界与立场提示。",
  "boundaries": [
    "不要让人物知道其身后才发生的事件。"
  ],
  "keywords": [],
  "related_lessons": [
    "lesson-sample"
  ],
  "source_refs": [
    {
      "title": "《李将军列传》",
      "source": "《史记》，中华书局点校本",
      "url_or_path": "卷一百九，李陵家族及相关记载",
      "citation_note": "",
      "reliability": "pending"
    },
    {
      "title": "《李陵苏武传》",
      "source": "《汉书》，中华书局点校本",
      "url_or_path": "卷五十四，相关篇章",
      "citation_note": "",
      "reliability": "pending"
    },
    {
      "title": "《报任安书》",
      "source": "《汉书·司马迁传》，中华书局点校本",
      "url_or_path": "司马迁为李陵辩护及获罪相关内容",
      "citation_note": "",
      "reliability": "pending"
    }
  ],
  "teacher_notes": "重点讲解李陵出征、兵败和被俘的过程，以及李陵事件对司马迁人生的影响。注意不要简单将李陵概括为“贪生怕死”或“民族叛徒”，应结合当时的战争形势、兵力差距和史料记载进行分析。",
  "status": "sealed",
  "version": 44,
  "created_at": "2026-09-11T04:42:44.821865Z",
  "updated_at": "2026-09-14T13:21:41.749821Z",
  "sealed_at": "2026-09-14T13:21:41.749821Z",
  "sealed_by": "local-admin",
  "checksum": "7a873185388c4e3705eb280ce7a6e9b47c47d01872df0911750c8eae63138af1"
}
