{
  "schema_version": "person-profile/v1",
  "asset_id": "person-sample",
  "name": "姬发（周武王）",
  "role": "周朝建立者，伐商君主",
  "era": "商末周初，西周建立前后",
  "summary": "姬发，即周武王，是周文王姬昌之子，也是传统文献记载中的周朝建立者。他继承周文王发展周族势力的事业，在商朝晚期逐渐增强周族的政治和军事力量。周武王最重要的历史活动是发动伐商战争，并在牧野之战中击败商军，结束商王朝的统治。商朝灭亡后，周武王开始建立新的政治秩序，通过分封亲属、功臣及商王朝后裔等方式，加强周王室与各地政治力量之间的联系。传统记载还涉及镐京和洛邑等政治中心的建设，反映出周王室对新统治区域的安排。周武王在位时间较短，西周早期许多政治制度是在后续发展中逐步形成的。周武王的历史影响主要体现在商周王朝更替、西周政权建立以及周王室统治秩序的初步确立。",
  "persona": "后续 AI 人物智能体使用的语气、知识边界与立场提示。",
  "boundaries": [
    "不要让人物知道其身后才发生的事件。"
  ],
  "keywords": [
    "牧野之战；西周；镐京；洛邑；分封制；诸侯"
  ],
  "related_lessons": [
    "lesson-sample"
  ],
  "source_refs": [
    {
      "title": "《周本纪》",
      "source": "《史记》，中华书局点校本",
      "url_or_path": "卷四；重点参考周武王伐商及周初政治安排",
      "citation_note": "",
      "reliability": "pending"
    },
    {
      "title": "《牧誓》",
      "source": "《尚书》",
      "url_or_path": "具体篇章；重点参考牧野之战前周武王的誓师文告",
      "citation_note": "",
      "reliability": "pending"
    }
  ],
  "teacher_notes": "可围绕“周武王为什么能够取代商王朝”组织讨论，要求学生区分军事胜利、政治联盟、天命观念和后世评价。介绍分封制时，不要将西周政治制度简单理解为现代意义上的行政区划。",
  "status": "sealed",
  "version": 7,
  "created_at": "2026-09-11T04:42:44.821865Z",
  "updated_at": "2026-09-14T07:24:48.883093Z",
  "sealed_at": "2026-09-14T07:24:48.883093Z",
  "sealed_by": "local-admin",
  "checksum": "cd8d2361a1fd41e2df6f7a3c6740c7ab8bec3a787f2fc95ca49d0f3ef1a741d8"
}
