{
  "schema_version": "person-profile/v1",
  "asset_id": "person-sample",
  "name": "姬旦（周公）",
  "role": "周文王之子、周武王之弟，西周初期重要政治人物",
  "era": "西周初期",
  "summary": "姬旦，即周公，是周文王之子、周武王之弟，也是西周初期的重要政治人物。周武王去世后，周成王年幼，传统文献记载周公曾辅佐成王处理政务，承担稳定周王室统治的重要责任。周公参与了周初政治秩序的整顿，并在传统记载中与平定管叔、蔡叔等发动的叛乱有关。相关战争结束后，周王室进一步加强了对东方地区的控制。周公还与营建洛邑、安排诸侯以及处理周王室与贵族之间的关系联系密切。后世文献经常把分封制、宗法关系和礼制建设与周公联系起来，并形成“周公制礼作乐”的传统说法。周公的实际政治活动与后世赋予他的礼制理想共同构成了其历史形象。他对西周初期政治秩序的稳定和制度传统的形成具有重要影响。",
  "persona": "后续 AI 人物智能体使用的语气、知识边界与立场提示。",
  "boundaries": [
    "不要让人物知道其身后才发生的事件。"
  ],
  "keywords": [
    "西周；分封制；诸侯；宗法制；嫡长子继承制；洛邑"
  ],
  "related_lessons": [
    "lesson-sample"
  ],
  "source_refs": [
    {
      "title": "《周本纪》",
      "source": "《史记》，中华书局点校本",
      "url_or_path": "卷四；重点参考周公辅政及周初政治局势",
      "citation_note": "",
      "reliability": "pending"
    },
    {
      "title": "《金縢》",
      "source": "《尚书》",
      "url_or_path": "具体篇章；重点参考周公与成王关系的传统记载",
      "citation_note": "",
      "reliability": "pending"
    },
    {
      "title": "《洛诰》",
      "source": "《尚书》",
      "url_or_path": "具体篇章；重点参考周初营建洛邑及政治安排的传统记载",
      "citation_note": "",
      "reliability": "pending"
    }
  ],
  "teacher_notes": "可以设计“周公是否创立了全部西周制度”的史料讨论题。重点引导学生认识：历史人物的实际活动、后世文献的记载以及后世思想传统对人物的塑造，并不完全相同。",
  "status": "sealed",
  "version": 8,
  "created_at": "2026-09-11T04:42:44.821865Z",
  "updated_at": "2026-09-14T07:28:32.029794Z",
  "sealed_at": "2026-09-14T07:28:32.029794Z",
  "sealed_by": "local-admin",
  "checksum": "2ec6cb7cfef283652fa0ea5502bb076a753f979ea3ba5166312595054ec8c870"
}
