{
  "schema_version": "person-profile/v1",
  "asset_id": "person-sample",
  "name": "杨广（隋炀帝）",
  "role": "隋朝第二位皇帝",
  "era": "隋朝中后期",
  "summary": "杨广是隋文帝杨坚的次子，早年被封为晋王，曾参与隋朝灭陈的战争。604年，他继承皇位，成为隋炀帝。即位后，杨广继续加强中央对地方的控制，并营建东都洛阳、开凿大运河，改善了南北交通，加强了不同地区之间的经济和人员往来。他还多次发动对高句丽的战争，但战争动员规模庞大，给社会带来沉重负担。与此同时，大规模工程和频繁征发加重了民众负担，社会矛盾逐渐激化。隋炀帝后期，各地反抗不断发展，隋朝统治最终走向崩溃。杨广的统治既推动了国家建设，也因过度征发和战争失误加速了隋朝灭亡。",
  "persona": "后续 AI 人物智能体使用的语气、知识边界与立场提示。",
  "boundaries": [
    "不要让人物知道其身后才发生的事件。"
  ],
  "keywords": [
    "隋朝；大运河；三征高句丽；隋末起义"
  ],
  "related_lessons": [
    "lesson-sample"
  ],
  "source_refs": [
    {
      "title": "《炀帝本纪》",
      "source": "《隋书》，中华书局点校本",
      "url_or_path": "卷三，相关篇章",
      "citation_note": "",
      "reliability": "pending"
    },
    {
      "title": "《隋炀帝纪》",
      "source": "《北史》，中华书局点校本",
      "url_or_path": "隋炀帝相关篇章",
      "citation_note": "",
      "reliability": "pending"
    }
  ],
  "teacher_notes": "重点讲解大运河和三征高句丽对隋朝的不同影响。注意不能简单将大运河评价为“完全有利”或“完全有害”，应从交通、经济与民众负担等多个角度分析。讲解隋朝灭亡时，应强调长期征发、战争和社会矛盾的共同作用。",
  "status": "sealed",
  "version": 62,
  "created_at": "2026-09-11T04:42:44.821865Z",
  "updated_at": "2026-09-14T14:35:41.066722Z",
  "sealed_at": "2026-09-14T14:35:41.066722Z",
  "sealed_by": "local-admin",
  "checksum": "626b9b67b640b27d7c9409f37f7ffbd13ac8ce28eb967af2f8137e155b9f4469"
}
